{
  "schemaVersion": 1,
  "scenarioId": "audio-import.success-retains-and-reopens",
  "initialState": { "status": "idle" },
  "commands": [{ "kind": "chooseAudio" }],
  "dependencyTrace": [
    { "port": "audioImport", "effect": "choose", "outcome": "selected" },
    { "port": "clock", "effect": "now", "outcome": "2026-08-30T12:00:00.000Z" },
    { "port": "sessionIdGenerator", "effect": "generateSessionId", "outcome": "ses-20260830T120000000Z-3DEF" },
    { "port": "audioImport", "effect": "reserveSessionId", "outcome": "reserved" },
    { "port": "audioImport", "effect": "prepare", "outcome": "candidate" },
    { "port": "audioImport", "effect": "install", "outcome": "reopened" }
  ],
  "expectedState": {
    "status": "succeeded",
    "sessionId": "ses-20260830T120000000Z-3DEF"
  }
}
